{
  "name": "Goblin Cave",
  "mapUrl": "maps/dungeon_scrawl/dungeon.png",
  "dimensions": { "width": 225, "height": 185 },
  "startingLocations": [
    { "x": 132.5, "y": 77.5, "facing": 0 }
  ],
  "walls": [
    [
      { "x":  65.0, "y":  95.0 },
      { "x":  90.0, "y":  95.0 },
      { "x":  90.0, "y":  90.0 },
      { "x": 100.0, "y":  90.0 },
      { "x": 100.0, "y":  85.0 },
      { "x": 120.0, "y":  85.0 },
      { "x": 120.0, "y": 100.0 },
      { "x": 135.0, "y": 100.0 },
      { "x": 135.0, "y": 120.0 }
    ],
    [
      { "x":  90.0, "y":  60.0 },
      { "x":  90.0, "y":  70.0 },
      { "x": 100.0, "y":  70.0 },
      { "x": 100.0, "y":  75.0 },
      { "x": 120.0, "y":  75.0 },
      { "x": 120.0, "y":  70.0 },
      { "x": 130.0, "y":  70.0 },
      { "x": 130.0, "y":  50.0 }
    ],
    [
      { "x": 145.0, "y": 120.0 },
      { "x": 145.0, "y": 100.0 },
      { "x": 160.0, "y": 100.0 }
    ]
  ],
  "units": [
    {
      "name": "Goblin Raider",
      "tokenColor": "#8B2500",
      "maxHP": 20,
      "currentHP": 14,
      "tokenImageUrl": "tokens/too-many-tokens/GoblinGrasslandMaleGreenMelee (15).webp",
      "facingAngle": 2.756,
      "location": { "x": 131.2, "y": 80.7 },
      "tokenScale": 0.75
    },
    {
      "name": "Goblin Raider",
      "tokenColor": "#8B2500",
      "maxHP": 20,
      "tokenImageUrl": "tokens/too-many-tokens/GoblinGrasslandMaleRedMelee (1).webp",
      "facingAngle": 1.952,
      "location": { "x": 128.8, "y": 79.0 },
      "tokenScale": 0.75
    },
    {
      "name": "Goblin Archer",
      "tokenColor": "#8B2500",
      "maxHP": 20,
      "currentHP": 8,
      "tokenImageUrl": "tokens/too-many-tokens/GoblinUnderdarkMaleYellowMelee (13).webp",
      "facingAngle": 1.5708,
      "location": { "x": 110.5, "y": 77.5 },
      "tokenScale": 0.75
    }
  ]
}
